{
  "task_id": "c9f51725-1747-4e31-a162-57486eedb996",
  "title": "Build a Simple Todo List App",
  "description": "Create a simple todo list web application with the following features:\n\nFeatures:\n- Add new tasks with a text input\n- Mark tasks as complete with checkboxes\n- Delete tasks with a delete button\n- Filter tasks (all, active, completed)\n- Task counter showing remaining items\n- Local storage persistence (tasks saved on page reload)\n- Clean, modern UI with Tailwind CSS\n- Responsive design for mobile and desktop\n\nTech Stack:\n- Frontend: React with Next.js 13+\n- Styling: Tailwind CSS\n- Storage: Browser localStorage API\n- State Management: React hooks (useState, useEffect)\n\nRequirements:\n- Keep the code simple and well-commented\n- Use functional components only\n- Implement proper error handling\n- Add basic accessibility features (ARIA labels)\n- Ensure tasks persist across browser sessions\n\nThe app should be production-ready with clean code and good UX.",
  "priority": "high",
  "created_at": "2025-10-21T22:52:47.259Z",
  "created_by": "web-ui",
  "context": {},
  "config": {
    "enable_validation": true,
    "max_retries": 3
  },
  "status": "pending"
}